{
  "ticker": "0700.HK",
  "eps": {
    "2021": 15.03,
    "2022": 12.51,
    "2023": 10.38,
    "2024": 28.04,
    "2025": 32.47,
    "2026": 37.49,
    "2027": 40.90
  },
  "pe_bands": {
    "嚴重高估": 30,
    "高估": 25.0,
    "合理偏高": 21,
    "合理估值": 18.5,
    "合理偏低": 16,
    "低估": 14.0,
    "嚴重低估": 10
  },
  "notes": {
    "currency": "HKD",
    "exchange_rate": 1.136,
    "description": "EPS 以港幣計算，股價亦以港幣計算。RMB EPS 已按 1.136 匯率換算成 HKD (2026年4月匯率)"
  }
}
